{
  "$schema": "./schema/subtitle.schema.json",
  "version": 2,
  "description": "Source-boundary and subtitle assembler contract.",
  "limits": {
    "japaneseCharacterLimit": 60,
    "englishCharacterLimit": 120,
    "ellipsis": "…"
  },
  "clip": [
    {
      "name": "short japanese is unchanged",
      "input": { "literal": "こんにちは、世界。" },
      "expected": { "literal": "こんにちは、世界。" }
    },
    {
      "name": "short english is unchanged",
      "input": { "literal": "Hello world" },
      "expected": { "literal": "Hello world" }
    }
  ],
  "assembler": {
    "idleFinalizeSeconds": 8,
    "cases": [
      {
        "name": "complete pair finalizes at an empty split",
        "epoch": 1,
        "expectLane": "en",
        "steps": [
          { "at": 0, "kind": "sourceDelta", "lane": "source", "text": "こんにちは", "eventId": "s1", "elapsedMs": 100 },
          { "at": 0.2, "kind": "translationDelta", "lane": "en", "text": "Hello", "eventId": "t1", "elapsedMs": 200 },
          { "at": 0.3, "kind": "languageSwitch", "boundaryOffset": 5 }
        ],
        "expectedFinalizedPairs": [
          { "sourceText": "こんにちは", "translatedText": "Hello" }
        ],
        "expectedFinal": {
          "sourceText": "",
          "translatedText": "",
          "isTranslationCurrent": false,
          "shouldFinalize": false
        }
      },
      {
        "name": "split english arrival moves the whole english sentence",
        "epoch": 1,
        "expectLane": "en",
        "steps": [
          { "at": 0, "kind": "sourceDelta", "lane": "source", "text": "あいうえおかきく", "eventId": "s1", "elapsedMs": 100 },
          { "at": 0.2, "kind": "translationDelta", "lane": "en", "text": "It is sunny today.", "eventId": "t1", "elapsedMs": 200 },
          { "at": 0.3, "kind": "sourceDelta", "lane": "source", "text": "To", "eventId": "s2", "elapsedMs": 300 },
          { "at": 0.4, "kind": "sourceDelta", "lane": "source", "text": "day it is sunny outside", "eventId": "s3", "elapsedMs": 400 },
          { "at": 0.5, "kind": "languageSwitch", "boundaryOffset": 8 }
        ],
        "expectedFinalizedPairs": [
          { "sourceText": "あいうえおかきく", "translatedText": "It is sunny today." }
        ],
        "expectedFinal": {
          "sourceText": "Today it is sunny outside",
          "translatedText": "",
          "isTranslationCurrent": false,
          "shouldFinalize": false
        }
      },
      {
        "name": "boundary inside one delta keeps every character",
        "epoch": 1,
        "expectLane": "en",
        "steps": [
          { "at": 0, "kind": "sourceDelta", "lane": "source", "text": "あいうえおかきく", "eventId": "s1", "elapsedMs": 100 },
          { "at": 0.2, "kind": "translationDelta", "lane": "en", "text": "It is sunny.", "eventId": "t1", "elapsedMs": 200 },
          { "at": 0.3, "kind": "sourceDelta", "lane": "source", "text": "Today is sunny outside", "eventId": "s2", "elapsedMs": 300 },
          { "at": 0.4, "kind": "languageSwitch", "boundaryOffset": 8 }
        ],
        "expectedFinalizedPairs": [
          { "sourceText": "あいうえおかきく", "translatedText": "It is sunny." }
        ],
        "expectedFinal": {
          "sourceText": "Today is sunny outside",
          "translatedText": "",
          "isTranslationCurrent": false,
          "shouldFinalize": false
        }
      },
      {
        "name": "old translation that did not catch up is not recorded",
        "epoch": 1,
        "expectLane": "en",
        "steps": [
          { "at": 0, "kind": "sourceDelta", "lane": "source", "text": "あいうえお", "eventId": "s1", "elapsedMs": 100 },
          { "at": 0.2, "kind": "translationDelta", "lane": "en", "text": "Hello", "eventId": "t1", "elapsedMs": 200 },
          { "at": 0.3, "kind": "sourceDelta", "lane": "source", "text": "かきくけ", "eventId": "s2", "elapsedMs": 300 },
          { "at": 0.4, "kind": "languageSwitch", "boundaryOffset": 9 }
        ],
        "expectedFinalizedPairs": [],
        "expectedFinal": {
          "sourceText": "",
          "translatedText": "",
          "isTranslationCurrent": false,
          "shouldFinalize": false
        }
      },
      {
        "name": "source only does not finalize without a translation",
        "epoch": 1,
        "expectLane": "en",
        "steps": [
          { "at": 0, "kind": "sourceDelta", "lane": "source", "text": "こんにちは", "eventId": "s1", "elapsedMs": 100 },
          { "at": 9, "kind": "tick" }
        ],
        "expectedFinalizedPairs": [],
        "expectedFinal": { "sourceText": "こんにちは", "translatedText": "", "isTranslationCurrent": false, "shouldFinalize": false }
      },
      {
        "name": "complete pair finalizes after the idle interval",
        "epoch": 1,
        "expectLane": "en",
        "steps": [
          { "at": 0, "kind": "sourceDelta", "lane": "source", "text": "こんにちは", "eventId": "s1", "elapsedMs": 100 },
          { "at": 0.2, "kind": "translationDelta", "lane": "en", "text": "Hello", "eventId": "t1", "elapsedMs": 200 },
          { "at": 9, "kind": "tick" }
        ],
        "expectedFinalizedPairs": [{ "sourceText": "こんにちは", "translatedText": "Hello" }],
        "expectedFinal": { "sourceText": "こんにちは", "translatedText": "Hello", "isTranslationCurrent": true, "shouldFinalize": true }
      },
      {
        "name": "expected lane wins over the echo lane",
        "epoch": 1,
        "expectLane": "ja",
        "steps": [
          { "at": 0, "kind": "sourceDelta", "lane": "source", "text": "Hello there", "eventId": "s1", "elapsedMs": 100 },
          { "at": 0.1, "kind": "translationDelta", "lane": "en", "text": "Hello there", "eventId": "t-echo", "elapsedMs": 150 },
          { "at": 0.2, "kind": "translationDelta", "lane": "ja", "text": "こんにちは", "eventId": "t1", "elapsedMs": 200 }
        ],
        "expectedFinalizedPairs": [],
        "expectedFinal": { "sourceText": "Hello there", "translatedText": "こんにちは", "isTranslationCurrent": true, "shouldFinalize": false }
      },
      {
        "name": "events from another epoch are ignored",
        "epoch": 2,
        "expectLane": "en",
        "steps": [
          { "at": 0, "kind": "sourceDelta", "lane": "source", "text": "stale", "eventId": "s0", "elapsedMs": 10, "epoch": 1 },
          { "at": 0.1, "kind": "sourceDelta", "lane": "source", "text": "こんにちは", "eventId": "s1", "elapsedMs": 100 }
        ],
        "expectedFinalizedPairs": [],
        "expectedFinal": { "sourceText": "こんにちは", "translatedText": "", "isTranslationCurrent": false, "shouldFinalize": false }
      },
      {
        "name": "duplicate event ids are ignored",
        "epoch": 1,
        "expectLane": "en",
        "steps": [
          { "at": 0, "kind": "sourceDelta", "lane": "source", "text": "あい", "eventId": "s1", "elapsedMs": 100 },
          { "at": 0.1, "kind": "sourceDelta", "lane": "source", "text": "あい", "eventId": "s1", "elapsedMs": 100 }
        ],
        "expectedFinalizedPairs": [],
        "expectedFinal": { "sourceText": "あい", "translatedText": "", "isTranslationCurrent": false, "shouldFinalize": false }
      },
      {
        "name": "language switch finalizes a complete pair",
        "epoch": 1,
        "expectLane": "en",
        "steps": [
          { "at": 0, "kind": "sourceDelta", "lane": "source", "text": "こんにちは", "eventId": "s1", "elapsedMs": 100 },
          { "at": 0.2, "kind": "translationDelta", "lane": "en", "text": "Hello", "eventId": "t1", "elapsedMs": 200 },
          { "at": 0.3, "kind": "languageSwitch", "boundaryOffset": 5 }
        ],
        "expectedFinalizedPairs": [{ "sourceText": "こんにちは", "translatedText": "Hello" }],
        "expectedFinal": { "sourceText": "", "translatedText": "", "isTranslationCurrent": false, "shouldFinalize": false }
      },
      {
        "name": "language switch does not finalize stale pair",
        "epoch": 1,
        "expectLane": "en",
        "steps": [
          { "at": 0, "kind": "sourceDelta", "lane": "source", "text": "こんにちは", "eventId": "s1", "elapsedMs": 100 },
          { "at": 0.2, "kind": "translationDelta", "lane": "en", "text": "Hello", "eventId": "t1", "elapsedMs": 200 },
          { "at": 0.4, "kind": "sourceDelta", "lane": "source", "text": "、皆さん", "eventId": "s2", "elapsedMs": 300 },
          { "at": 0.5, "kind": "languageSwitch", "boundaryOffset": 9 }
        ],
        "expectedFinalizedPairs": [],
        "expectedFinal": { "sourceText": "", "translatedText": "", "isTranslationCurrent": false, "shouldFinalize": false }
      },
      {
        "name": "late translation after new-language source still finalizes the prefix",
        "epoch": 1,
        "expectLane": "en",
        "steps": [
          { "at": 0, "kind": "sourceDelta", "lane": "source", "text": "こんにちは", "eventId": "s1", "elapsedMs": 100 },
          { "at": 0.2, "kind": "sourceDelta", "lane": "source", "text": " Hello", "eventId": "s2", "elapsedMs": 200 },
          { "at": 0.3, "kind": "translationDelta", "lane": "en", "text": "Hello", "eventId": "t1", "elapsedMs": 300 },
          { "at": 0.4, "kind": "languageSwitch", "boundaryOffset": 5 }
        ],
        "expectedFinalizedPairs": [{ "sourceText": "こんにちは", "translatedText": "Hello" }],
        "expectedFinal": { "sourceText": " Hello", "translatedText": "", "isTranslationCurrent": false, "shouldFinalize": false }
      },
      {
        "name": "language switch without pair clears buffers for the next source",
        "epoch": 1,
        "expectLane": "en",
        "steps": [
          { "at": 0, "kind": "sourceDelta", "lane": "source", "text": "こんにちは", "eventId": "s1", "elapsedMs": 100 },
          { "at": 0.1, "kind": "languageSwitch", "boundaryOffset": 5 },
          { "at": 0.2, "kind": "sourceDelta", "lane": "source", "text": "Hello there", "eventId": "s2", "elapsedMs": 200 }
        ],
        "expectedFinalizedPairs": [],
        "expectedFinal": { "sourceText": "Hello there", "translatedText": "", "isTranslationCurrent": false, "shouldFinalize": false }